{
  "schema_version": "1.0.0", "task_id": "sdpa_forward_a", "tier": "A_kernel", "environment_snapshot": "fixture-mp22", "submission_digest": "sha256:fixture", "status": "pass",
  "stages": [{"name": "schema", "status": "pass", "exit_code": 0, "details": {}}],
  "metrics": {"compile_rate": 1.0, "correctness_rate": 1.0, "speedup": null}
}
